{
    "natural_language_goal": "Add a user message delegate system with ANSI colored output.",
    "plan": [
        {
            "subtask_id": "3393e4b9-9313-43c7-8525-bac48da71a26",
            "name": "analyze_user_message_requirements",
            "description": "Analyze the requirements for the user message delegate, identifying the necessary components and interactions.",
            "file_path": "project_dev/in_dev/add_user_message_delegate/subtask_3393e4b9-9313-43c7-8525-bac48da71a26.json",
            "type": "planning",
            "depends_on": [],
            "input_artifacts": [],
            "output_artifacts": [
                "docs/user_message_analysis.md"
            ],
            "completed": true
        },
        {
            "subtask_id": "02d4e9da-0643-457b-87b5-23a76ec49334",
            "name": "create_user_message_delegate_tests",
            "description": "Generate tests for the user message delegate and the basic output test class, ensuring they cover different message levels and ANSI coloring.",
            "file_path": "project_dev/in_dev/add_user_message_delegate/subtask_02d4e9da-0643-457b-87b5-23a76ec49334.json",
            "type": "test_generation",
            "depends_on": [
                "analyze_user_message_requirements"
            ],
            "input_artifacts": [
                "docs/user_message_analysis.md"
            ],
            "output_artifacts": [
                "tests/test_user_message_delegate.py"
            ],
            "completed": true
        },
        {
            "subtask_id": "0e4c4ac3-7596-49db-a0f7-2175c2b29380",
            "name": "implement_user_message_delegate",
            "description": "Implement the user message delegate interface and the basic output test class.",
            "file_path": "project_dev/in_dev/add_user_message_delegate/subtask_0e4c4ac3-7596-49db-a0f7-2175c2b29380.json",
            "type": "code_generation",
            "depends_on": [
                "create_user_message_delegate_tests"
            ],
            "input_artifacts": [
                "docs/user_message_analysis.md",
                "tests/test_user_message_delegate.py"
            ],
            "output_artifacts": [
                "src/user_message_delegate.py",
                "src/basic_output_test.py"
            ],
            "completed": true
        },
        {
            "subtask_id": "a9ec2322-6de8-4d62-92a6-ef6f669910d8",
            "name": "integrate_user_message_delegate",
            "description": "Integrate the user message delegate into the main application flow.",
            "file_path": "project_dev/in_dev/add_user_message_delegate/subtask_a9ec2322-6de8-4d62-92a6-ef6f669910d8.json",
            "type": "file_edit",
            "depends_on": [
                "implement_user_message_delegate"
            ],
            "input_artifacts": [
                "src/user_message_delegate.py",
                "src/basic_output_test.py"
            ],
            "output_artifacts": [],
            "completed": true
        },
        {
            "subtask_id": "003a9c38-a8b8-48d1-85a5-abffc5a9b78e",
            "name": "update_documentation",
            "description": "Update documentation to reflect the new user message delegate system.",
            "file_path": "project_dev/in_dev/add_user_message_delegate/subtask_003a9c38-a8b8-48d1-85a5-abffc5a9b78e.json",
            "type": "documentation",
            "depends_on": [
                "integrate_user_message_delegate"
            ],
            "input_artifacts": [
                "docs/user_message_analysis.md",
                "src/user_message_delegate.py",
                "src/basic_output_test.py"
            ],
            "output_artifacts": [],
            "completed": true
        },
        {
            "subtask_id": "e457c511-5425-44db-bc0a-a5aa53d02a72",
            "name": "final_validation",
            "description": "Perform a final validation to ensure the user message delegate works as expected and all requirements are met.",
            "file_path": "project_dev/in_dev/add_user_message_delegate/subtask_e457c511-5425-44db-bc0a-a5aa53d02a72.json",
            "type": "validation",
            "depends_on": [
                "update_documentation"
            ],
            "input_artifacts": [
                "tests/test_user_message_delegate.py"
            ],
            "output_artifacts": [],
            "completed": true
        }
    ],
    "task_id": "6eae9bfb-2bd0-4ad1-926f-4a2ca71d1d16",
    "input_hashes": {
        "requirements_md": "d33ecde197b7eab01e32a588a75615b7eff2aa0d1172e3bf2e12a02d2508e416",
        "config_yaml": "ef050ce016c2e06b9bdadda4f22ae52229b7d014f3e61fb616fec45e76803e4b"
    }
}