{
    "natural_language_goal": "Add thread-safe delegates and observers to the execution engine and AI loop for monitoring and debugging.",
    "plan": [
        {
            "subtask_id": "1d8c6b7a-9f99-42d4-9927-9e6afa03fe82",
            "name": "analyze_delegate_requirements",
            "description": "Analyze the provided documentation on thread-safe delegates to understand the design principles and implementation strategy for integrating them into the execution engine and AI loop.",
            "file_path": "project_dev/in_dev/delegates_executionengine/subtask_1d8c6b7a-9f99-42d4-9927-9e6afa03fe82.json",
            "type": "planning",
            "depends_on": [],
            "input_artifacts": [
                "project_dev/notes/Thread-Safe Delegates Design Document.md",
                "project_dev/notes/Thread-Safe Delegates in Python - Usage Guide.md"
            ],
            "output_artifacts": [
                "project_dev/planning/delegate_integration_plan.md"
            ],
            "completed": true
        },
        {
            "subtask_id": "f8ce5cd5-ceef-460c-9563-85ee5e13782d",
            "name": "generate_tests_for_execution_engine_delegates",
            "description": "Generate test cases for the integration of thread-safe delegates into the execution engine.",
            "file_path": "project_dev/in_dev/delegates_executionengine/subtask_f8ce5cd5-ceef-460c-9563-85ee5e13782d.json",
            "type": "test_generation",
            "depends_on": [
                "analyze_delegate_requirements"
            ],
            "input_artifacts": [
                "project_dev/planning/delegate_integration_plan.md",
                "project_dev/notes/thread_safe_delegates.py"
            ],
            "output_artifacts": [
                "tests/execution_engine/test_delegates.py"
            ],
            "completed": true
        },
        {
            "subtask_id": "baef535d-0efe-48b7-a46b-b6498d477fb3",
            "name": "implement_execution_engine_delegates",
            "description": "Implement the thread-safe delegate system within the execution engine.",
            "file_path": "project_dev/in_dev/delegates_executionengine/subtask_baef535d-0efe-48b7-a46b-b6498d477fb3.json",
            "type": "file_edit",
            "depends_on": [
                "generate_tests_for_execution_engine_delegates"
            ],
            "input_artifacts": [
                "project_dev/planning/delegate_integration_plan.md",
                "project_dev/notes/thread_safe_delegates.py",
                "tests/execution_engine/test_delegates.py"
            ],
            "output_artifacts": [],
            "completed": true
        },
        {
            "subtask_id": "10102862-a9f4-4600-acf4-72cb8818db44",
            "name": "validate_execution_engine_delegates",
            "description": "Validate the implementation of thread-safe delegates in the execution engine by running the generated tests.",
            "file_path": "project_dev/in_dev/delegates_executionengine/subtask_10102862-a9f4-4600-acf4-72cb8818db44.json",
            "type": "validation",
            "depends_on": [
                "implement_execution_engine_delegates"
            ],
            "input_artifacts": [
                "tests/execution_engine/test_delegates.py"
            ],
            "output_artifacts": [],
            "completed": true
        },
        {
            "subtask_id": "208127ec-1441-4b90-a6b9-070c1a088e36",
            "name": "generate_tests_for_ai_loop_delegates",
            "description": "Generate test cases for the integration of thread-safe delegates into the AI loop.",
            "file_path": "project_dev/in_dev/delegates_executionengine/subtask_208127ec-1441-4b90-a6b9-070c1a088e36.json",
            "type": "test_generation",
            "depends_on": [
                "analyze_delegate_requirements"
            ],
            "input_artifacts": [
                "project_dev/planning/delegate_integration_plan.md",
                "project_dev/notes/thread_safe_delegates.py"
            ],
            "output_artifacts": [
                "tests/ai_loop/test_delegates.py"
            ],
            "completed": true
        },
        {
            "subtask_id": "69d225f9-0d0c-4f72-966f-3fb455734f94",
            "name": "implement_ai_loop_delegates",
            "description": "Implement the thread-safe delegate system within the AI loop.",
            "file_path": "project_dev/in_dev/delegates_executionengine/subtask_69d225f9-0d0c-4f72-966f-3fb455734f94.json",
            "type": "file_edit",
            "depends_on": [
                "generate_tests_for_ai_loop_delegates"
            ],
            "input_artifacts": [
                "project_dev/planning/delegate_integration_plan.md",
                "project_dev/notes/thread_safe_delegates.py",
                "tests/ai_loop/test_delegates.py"
            ],
            "output_artifacts": [],
            "completed": true
        },
        {
            "subtask_id": "7e344ba3-536d-476d-aad1-67b5c523511c",
            "name": "validate_ai_loop_delegates",
            "description": "Validate the implementation of thread-safe delegates in the AI loop by running the generated tests.",
            "file_path": "project_dev/in_dev/delegates_executionengine/subtask_7e344ba3-536d-476d-aad1-67b5c523511c.json",
            "type": "validation",
            "depends_on": [
                "implement_ai_loop_delegates"
            ],
            "input_artifacts": [
                "tests/ai_loop/test_delegates.py"
            ],
            "output_artifacts": [],
            "completed": true
        },
        {
            "subtask_id": "c554fa89-46ec-4e91-aedb-36f5e11bdbd1",
            "name": "update_documentation",
            "description": "Update documentation to reflect the addition of delegates and observers to the execution engine and AI loop.",
            "file_path": "project_dev/in_dev/delegates_executionengine/subtask_c554fa89-46ec-4e91-aedb-36f5e11bdbd1.json",
            "type": "documentation",
            "depends_on": [
                "validate_execution_engine_delegates",
                "validate_ai_loop_delegates"
            ],
            "input_artifacts": [],
            "output_artifacts": [
                "docs/delegate_system.md",
                "README.md"
            ],
            "completed": false
        }
    ],
    "task_id": "0da84583-0c56-4c9e-b01a-6cfdfc728bcf",
    "input_hashes": {
        "requirements_md": "9ee724d1b65daa2244fdc00eb8d1c929aecd68e3a1aeb4bb7f050536f5ecdb79",
        "config_yaml": "ef050ce016c2e06b9bdadda4f22ae52229b7d014f3e61fb616fec45e76803e4b"
    }
}