{
    "natural_language_goal": "Ensure the runner correctly uses and is restricted to the workspace and output directories.",
    "plan": [
        {
            "subtask_id": "544a91f9-d203-485d-b21b-84c34e1529e5",
            "name": "analyze_path_manager_usage",
            "description": "Analyze how the path manager is currently used by the runner to identify areas needing modification for directory restriction.",
            "file_path": "project_dev/in_dev/ensure_runner_use_correct_dir/subtask_544a91f9-d203-485d-b21b-84c34e1529e5.json",
            "type": "planning",
            "depends_on": [],
            "input_artifacts": [],
            "output_artifacts": [
                "docs/path_manager_analysis.md"
            ],
            "completed": true
        },
        {
            "subtask_id": "c4a826cc-9982-4714-9fd4-ce5f9da1d1aa",
            "name": "design_directory_restriction_strategy",
            "description": "Design a strategy to restrict the runner's file system access to only the workspace and output directories.",
            "file_path": "project_dev/in_dev/ensure_runner_use_correct_dir/subtask_c4a826cc-9982-4714-9fd4-ce5f9da1d1aa.json",
            "type": "planning",
            "depends_on": [
                "analyze_path_manager_usage"
            ],
            "input_artifacts": [
                "docs/path_manager_analysis.md"
            ],
            "output_artifacts": [
                "docs/directory_restriction_strategy.md"
            ],
            "completed": true
        },
        {
            "subtask_id": "6bd24eb1-634b-4dc8-90e8-df21214238bd",
            "name": "generate_tests_for_directory_access",
            "description": "Generate tests to verify the runner's file system access restrictions and path handling.",
            "file_path": "project_dev/in_dev/ensure_runner_use_correct_dir/subtask_6bd24eb1-634b-4dc8-90e8-df21214238bd.json",
            "type": "test_generation",
            "depends_on": [
                "design_directory_restriction_strategy"
            ],
            "input_artifacts": [
                "docs/directory_restriction_strategy.md"
            ],
            "output_artifacts": [
                "tests/runner_directory_access_tests.py"
            ],
            "completed": true
        },
        {
            "subtask_id": "c5d97b00-1132-4b50-9818-85f672e57ab3",
            "name": "implement_directory_restriction",
            "description": "Implement the designed strategy to restrict the runner's file system access.",
            "file_path": "project_dev/in_dev/ensure_runner_use_correct_dir/subtask_c5d97b00-1132-4b50-9818-85f672e57ab3.json",
            "type": "file_edit",
            "depends_on": [
                "generate_tests_for_directory_access"
            ],
            "input_artifacts": [
                "docs/directory_restriction_strategy.md",
                "tests/runner_directory_access_tests.py"
            ],
            "output_artifacts": [],
            "completed": true
        },
        {
            "subtask_id": "a5c239c4-89dd-4acc-95eb-dfd531e65081",
            "name": "update_documentation",
            "description": "Update documentation (e.g., README, developer docs) to reflect the runner's directory access restrictions and path handling.",
            "file_path": "project_dev/in_dev/ensure_runner_use_correct_dir/subtask_a5c239c4-89dd-4acc-95eb-dfd531e65081.json",
            "type": "documentation",
            "depends_on": [
                "implement_directory_restriction"
            ],
            "input_artifacts": [],
            "output_artifacts": [
                "README.md",
                "docs/developer_guide.md"
            ],
            "completed": true
        }
    ],
    "task_id": "b8519038-a48f-49db-b426-01c08b9d59a4",
    "input_hashes": {
        "requirements_md": "46e850badf3109f08b4b03fcacccab74423812bed4dcd34ab67b0bb3cbbe952e",
        "config_yaml": "ef050ce016c2e06b9bdadda4f22ae52229b7d014f3e61fb616fec45e76803e4b"
    }
}