{
  "task_id": "a1b2c3d4-e5f6-7890-1234-567890abcdef",
  "natural_language_goal": "Execute a test plan to validate the runner's ability to orchestrate AI in generating, executing, and verifying a Python script that calculates a sequence of squares.",
  "input_hashes": {
    "requirements_md": "placeholder_requirements_hash",
    "config_yaml": "placeholder_config_hash"
  },
  "plan": [
    {
      "subtask_id": "11111111-2222-3333-4444-555555555555",
      "name": "Generate Python Script",
      "file_path": "tests/runner_tests/first_full_test/subtask_generate_script.json",
      "depends_on": [],
      "type": "code_generation"
    },
    {
      "subtask_id": "22222222-3333-4444-5555-666666666666",
      "name": "Execute Python Script",
      "file_path": "tests/runner_tests/first_full_test/subtask_execute_script.json",
      "depends_on": ["11111111-2222-3333-4444-555555555555"],
      "type": "ai_assistance"
    },
    {
      "subtask_id": "33333333-4444-5555-6666-777777777777",
      "name": "Read Output File",
      "file_path": "tests/runner_tests/first_full_test/subtask_read_output.json",
      "depends_on": ["22222222-3333-4444-5555-666666666666"],
      "type": "file_io"
    },
    {
      "subtask_id": "44444444-5555-6666-7777-888888888888",
      "name": "Verify Output File Content",
      "file_path": "tests/runner_tests/first_full_test/subtask_verify_output.json",
      "depends_on": ["33333333-4444-5555-6666-777777777777"],
      "type": "validation"
    }
  ]
}